[
  {
    "url": "https://www.premierleague.com/robots.txt",
    "collected_at": "2026-10-11T21:48:51.776510+00:00",
    "status": "source_blocked",
    "http_status": null,
    "reason": "proxy_tunnel_denied_403",
    "proxy_tunnel_status": 403,
    "origin": "real_access_attempt",
    "content_retrieved": false
  },
  {
    "url": "https://www.laliga.com/robots.txt",
    "collected_at": "2026-10-11T21:48:51.783040+00:00",
    "status": "source_blocked",
    "http_status": null,
    "reason": "proxy_tunnel_denied_403",
    "proxy_tunnel_status": 403,
    "origin": "real_access_attempt",
    "content_retrieved": false
  },
  {
    "url": "https://www.uefa.com/robots.txt",
    "collected_at": "2026-10-11T21:48:51.787213+00:00",
    "status": "source_blocked",
    "http_status": null,
    "reason": "proxy_tunnel_denied_403",
    "proxy_tunnel_status": 403,
    "origin": "real_access_attempt",
    "content_retrieved": false
  },
  {
    "url": "https://www.ccfc.co.uk/robots.txt",
    "collected_at": "2026-10-11T21:48:51.790783+00:00",
    "status": "source_blocked",
    "http_status": null,
    "reason": "proxy_tunnel_denied_403",
    "proxy_tunnel_status": 403,
    "origin": "real_access_attempt",
    "content_retrieved": false
  },
  {
    "url": "https://www.newcastleunited.com/robots.txt",
    "collected_at": "2026-10-11T21:48:51.794333+00:00",
    "status": "source_blocked",
    "http_status": null,
    "reason": "proxy_tunnel_denied_403",
    "proxy_tunnel_status": 403,
    "origin": "real_access_attempt",
    "content_retrieved": false
  },
  {
    "url": "https://www.levanteud.com/robots.txt",
    "collected_at": "2026-10-11T21:48:51.797538+00:00",
    "status": "source_blocked",
    "http_status": null,
    "reason": "proxy_tunnel_denied_403",
    "proxy_tunnel_status": 403,
    "origin": "real_access_attempt",
    "content_retrieved": false
  },
  {
    "url": "https://sevillafc.es/robots.txt",
    "collected_at": "2026-10-11T21:48:51.800655+00:00",
    "status": "source_blocked",
    "http_status": null,
    "reason": "proxy_tunnel_denied_403",
    "proxy_tunnel_status": 403,
    "origin": "real_access_attempt",
    "content_retrieved": false
  }
]
